{
    "$schema": "http://json-schema.org/draft-06/schema#",
    "$ref": "#/definitions/CoreNflSeasonTeam2024_12_Schema",
    "definitions": {
        "CoreNflSeasonTeam2024_12_Schema": {
            "type": "object",
            "additionalProperties": false,
            "properties": {
                "$ref": {
                    "type": "string",
                    "format": "uri",
                    "qt-uri-protocols": [
                        "http"
                    ]
                },
                "id": {
                    "type": "string",
                    "format": "integer"
                },
                "guid": {
                    "type": "string",
                    "format": "uuid"
                },
                "uid": {
                    "type": "string"
                },
                "alternateIds": {
                    "$ref": "#/definitions/AlternateIDS"
                },
                "slug": {
                    "type": "string"
                },
                "location": {
                    "type": "string"
                },
                "name": {
                    "type": "string"
                },
                "nickname": {
                    "type": "string"
                },
                "abbreviation": {
                    "type": "string"
                },
                "displayName": {
                    "type": "string"
                },
                "shortDisplayName": {
                    "type": "string"
                },
                "color": {
                    "type": "string"
                },
                "alternateColor": {
                    "type": "string"
                },
                "isActive": {
                    "type": "boolean"
                },
                "isAllStar": {
                    "type": "boolean"
                },
                "logos": {
                    "type": "array",
                    "items": {
                        "$ref": "#/definitions/Logo"
                    }
                },
                "record": {
                    "$ref": "#/definitions/AgainstTheSpreadRecords"
                },
                "oddsRecords": {
                    "$ref": "#/definitions/AgainstTheSpreadRecords"
                },
                "athletes": {
                    "$ref": "#/definitions/AgainstTheSpreadRecords"
                },
                "venue": {
                    "$ref": "#/definitions/Venue"
                },
                "groups": {
                    "$ref": "#/definitions/AgainstTheSpreadRecords"
                },
                "ranks": {
                    "$ref": "#/definitions/AgainstTheSpreadRecords"
                },
                "statistics": {
                    "$ref": "#/definitions/AgainstTheSpreadRecords"
                },
                "leaders": {
                    "$ref": "#/definitions/AgainstTheSpreadRecords"
                },
                "links": {
                    "type": "array",
                    "items": {
                        "$ref": "#/definitions/Link"
                    }
                },
                "injuries": {
                    "$ref": "#/definitions/AgainstTheSpreadRecords"
                },
                "notes": {
                    "$ref": "#/definitions/AgainstTheSpreadRecords"
                },
                "againstTheSpreadRecords": {
                    "$ref": "#/definitions/AgainstTheSpreadRecords"
                },
                "franchise": {
                    "$ref": "#/definitions/AgainstTheSpreadRecords"
                },
                "projection": {
                    "$ref": "#/definitions/AgainstTheSpreadRecords"
                },
                "events": {
                    "$ref": "#/definitions/AgainstTheSpreadRecords"
                },
                "transactions": {
                    "$ref": "#/definitions/AgainstTheSpreadRecords"
                },
                "coaches": {
                    "$ref": "#/definitions/AgainstTheSpreadRecords"
                },
                "attendance": {
                    "$ref": "#/definitions/AgainstTheSpreadRecords"
                }
            },
            "required": [
                "$ref",
                "abbreviation",
                "againstTheSpreadRecords",
                "alternateColor",
                "alternateIds",
                "athletes",
                "attendance",
                "coaches",
                "color",
                "displayName",
                "events",
                "franchise",
                "groups",
                "guid",
                "id",
                "injuries",
                "isActive",
                "isAllStar",
                "leaders",
                "links",
                "location",
                "logos",
                "name",
                "nickname",
                "notes",
                "oddsRecords",
                "projection",
                "ranks",
                "record",
                "shortDisplayName",
                "slug",
                "statistics",
                "transactions",
                "uid",
                "venue"
            ],
            "title": "CoreNflSeasonTeam2024_12_Schema"
        },
        "AgainstTheSpreadRecords": {
            "type": "object",
            "additionalProperties": false,
            "properties": {
                "$ref": {
                    "type": "string",
                    "format": "uri",
                    "qt-uri-protocols": [
                        "http"
                    ]
                }
            },
            "required": [
                "$ref"
            ],
            "title": "AgainstTheSpreadRecords"
        },
        "AlternateIDS": {
            "type": "object",
            "additionalProperties": false,
            "properties": {
                "sdr": {
                    "type": "string",
                    "format": "integer"
                }
            },
            "required": [
                "sdr"
            ],
            "title": "AlternateIDS"
        },
        "Link": {
            "type": "object",
            "additionalProperties": false,
            "properties": {
                "language": {
                    "$ref": "#/definitions/Language"
                },
                "rel": {
                    "type": "array",
                    "items": {
                        "type": "string"
                    }
                },
                "href": {
                    "type": "string",
                    "format": "uri",
                    "qt-uri-protocols": [
                        "https"
                    ]
                },
                "text": {
                    "type": "string"
                },
                "shortText": {
                    "type": "string"
                },
                "isExternal": {
                    "type": "boolean"
                },
                "isPremium": {
                    "type": "boolean"
                }
            },
            "required": [
                "href",
                "isExternal",
                "isPremium",
                "language",
                "rel",
                "shortText",
                "text"
            ],
            "title": "Link"
        },
        "Logo": {
            "type": "object",
            "additionalProperties": false,
            "properties": {
                "href": {
                    "type": "string",
                    "format": "uri",
                    "qt-uri-protocols": [
                        "https"
                    ],
                    "qt-uri-extensions": [
                        ".jpg",
                        ".png"
                    ]
                },
                "width": {
                    "type": "integer"
                },
                "height": {
                    "type": "integer"
                },
                "alt": {
                    "type": "string"
                },
                "rel": {
                    "type": "array",
                    "items": {
                        "type": "string"
                    }
                },
                "lastUpdated": {
                    "$ref": "#/definitions/LastUpdated"
                }
            },
            "required": [
                "alt",
                "height",
                "href",
                "rel",
                "width"
            ],
            "title": "Logo"
        },
        "Venue": {
            "type": "object",
            "additionalProperties": false,
            "properties": {
                "$ref": {
                    "type": "string",
                    "format": "uri",
                    "qt-uri-protocols": [
                        "http"
                    ]
                },
                "id": {
                    "type": "string",
                    "format": "integer"
                },
                "fullName": {
                    "type": "string"
                },
                "address": {
                    "$ref": "#/definitions/Address"
                },
                "grass": {
                    "type": "boolean"
                },
                "indoor": {
                    "type": "boolean"
                },
                "images": {
                    "type": "array",
                    "items": {
                        "$ref": "#/definitions/Logo"
                    }
                }
            },
            "required": [
                "$ref",
                "address",
                "fullName",
                "grass",
                "id",
                "images",
                "indoor"
            ],
            "title": "Venue"
        },
        "Address": {
            "type": "object",
            "additionalProperties": false,
            "properties": {
                "city": {
                    "type": "string"
                },
                "state": {
                    "type": "string"
                },
                "zipCode": {
                    "type": "string",
                    "format": "integer"
                },
                "country": {
                    "type": "string"
                }
            },
            "required": [
                "city",
                "country",
                "state",
                "zipCode"
            ],
            "title": "Address"
        },
        "Language": {
            "type": "string",
            "enum": [
                "en-US"
            ],
            "title": "Language"
        },
        "LastUpdated": {
            "type": "string",
            "enum": [
                "2024-06-25T18:51Z",
                "2024-12-03T20:49Z"
            ],
            "title": "LastUpdated"
        }
    }
}
